{
  "meta": {
    "schema_version": "1.0",
    "generated_at": "2026-06-01T09:00:00+00:00",
    "extractor_version": "stoa-engine/0.1.0",
    "registry_scan_hash": "sha256:9f2c1a7b4e0d3c88a15e6b2f0c4d7e91a3b8c2d5f6079e1a2b3c4d5e6f708192",
    "sample_data": true
  },
  "business_context": {
    "company": {
      "name": "Meridian Commerce Co.",
      "website": "https://meridian-commerce.example",
      "employees": 140,
      "industry": "E-commerce retail",
      "naics": "454110",
      "annual_revenue_usd": 38000000,
      "gross_profit_usd": 14200000,
      "description": "Direct-to-consumer e-commerce platform selling home and lifestyle goods, with AI systems supporting customer service and refunds."
    },
    "loss_history": [
      {
        "date": "2024-11-02",
        "description": "Chargeback dispute wave after a promo-code misconfiguration; no AI involvement.",
        "status": "closed"
      }
    ],
    "contracts": {
      "avg_value_usd": 42000,
      "largest_value_usd": 610000,
      "pct_standard_terms": 0.82,
      "liability_cap": {
        "type": "fee_pct",
        "value": 1.0
      },
      "provisions": [
        "limitation_of_liability",
        "indemnity",
        "warranty_disclaimer",
        "ai_output_disclaimer"
      ],
      "legal_counsel_reviews": true
    },
    "other_policies": [
      "Commercial General Liability",
      "Cyber Liability",
      "Technology E&O"
    ],
    "projections": {
      "next_2y": {
        "users": 2100000,
        "outputs": 9500000,
        "revenue_usd": 52000000
      }
    },
    "governance_owners": [
      {
        "name": "Dana Whitfield",
        "title": "VP Engineering"
      },
      {
        "name": "Priya Raman",
        "title": "Head of Risk & Compliance"
      }
    ]
  },
  "systems": [
    {
      "agent_id": "refund-agent",
      "display_name": "Refund Agent",
      "description": "Agentic assistant that evaluates refund requests and initiates payment refunds up to $500 without a human approval step.",
      "posture": {
        "model": {
          "value": "GPT-4o (hosted)",
          "evidence": [
            "src/agents/refund.py:L12"
          ],
          "confidence": "confirmed",
          "scan_hash": "sha256:9f2c1a7b4e0d3c88a15e6b2f0c4d7e91a3b8c2d5f6079e1a2b3c4d5e6f708192"
        },
        "business_activities": {
          "value": "Evaluates refund eligibility and initiates payment refunds",
          "evidence": [
            "src/agents/refund.py:L20-L58"
          ],
          "confidence": "confirmed",
          "scan_hash": "sha256:9f2c1a7b4e0d3c88a15e6b2f0c4d7e91a3b8c2d5f6079e1a2b3c4d5e6f708192"
        },
        "fine_tuned": {
          "value": false,
          "evidence": [
            "src/agents/refund.py:L12"
          ],
          "confidence": "confirmed",
          "scan_hash": "sha256:9f2c1a7b4e0d3c88a15e6b2f0c4d7e91a3b8c2d5f6079e1a2b3c4d5e6f708192"
        },
        "data_types": {
          "value": [
            "company_proprietary",
            "licensed_third_party"
          ],
          "evidence": [
            "src/agents/refund.py:L31"
          ],
          "confidence": "confirmed",
          "scan_hash": "sha256:9f2c1a7b4e0d3c88a15e6b2f0c4d7e91a3b8c2d5f6079e1a2b3c4d5e6f708192"
        },
        "sensitive_data": {
          "value": [
            "pii",
            "payment"
          ],
          "evidence": [
            "src/agents/refund.py:L34",
            "src/db/customers.py:L88"
          ],
          "confidence": "confirmed",
          "scan_hash": "sha256:9f2c1a7b4e0d3c88a15e6b2f0c4d7e91a3b8c2d5f6079e1a2b3c4d5e6f708192"
        },
        "output_types": {
          "value": [
            "text"
          ],
          "evidence": [
            "src/agents/refund.py:L60"
          ],
          "confidence": "confirmed",
          "scan_hash": "sha256:9f2c1a7b4e0d3c88a15e6b2f0c4d7e91a3b8c2d5f6079e1a2b3c4d5e6f708192"
        },
        "audience": {
          "value": "third_party",
          "evidence": [
            "src/agents/refund.py:L60"
          ],
          "confidence": "confirmed",
          "scan_hash": "sha256:9f2c1a7b4e0d3c88a15e6b2f0c4d7e91a3b8c2d5f6079e1a2b3c4d5e6f708192"
        },
        "io_logging": {
          "value": true,
          "evidence": [
            "src/agents/refund.py:L71",
            "config/logging.yaml:L4"
          ],
          "confidence": "confirmed",
          "scan_hash": "sha256:9f2c1a7b4e0d3c88a15e6b2f0c4d7e91a3b8c2d5f6079e1a2b3c4d5e6f708192"
        },
        "hitl": {
          "value": false,
          "evidence": [
            "src/agents/refund.py:L41",
            "scan:AI003-approval-absence"
          ],
          "confidence": "confirmed",
          "scan_hash": "sha256:9f2c1a7b4e0d3c88a15e6b2f0c4d7e91a3b8c2d5f6079e1a2b3c4d5e6f708192"
        },
        "agentic_actions": {
          "value": true,
          "evidence": [
            "src/agents/refund.py:L41-L52"
          ],
          "confidence": "confirmed",
          "scan_hash": "sha256:9f2c1a7b4e0d3c88a15e6b2f0c4d7e91a3b8c2d5f6079e1a2b3c4d5e6f708192"
        },
        "frameworks": {
          "value": [],
          "evidence": [],
          "confidence": "unknown",
          "scan_hash": "sha256:9f2c1a7b4e0d3c88a15e6b2f0c4d7e91a3b8c2d5f6079e1a2b3c4d5e6f708192"
        },
        "guardrails_intact": {
          "value": true,
          "evidence": [
            "src/agents/refund.py:L18"
          ],
          "confidence": "confirmed",
          "scan_hash": "sha256:9f2c1a7b4e0d3c88a15e6b2f0c4d7e91a3b8c2d5f6079e1a2b3c4d5e6f708192"
        }
      },
      "attestations": [
        {
          "claim_id": "refund-hitl-review",
          "claim_text": "A human reviews every refund before it is issued.",
          "declared": true,
          "observed": false,
          "status": "contradicted"
        },
        {
          "claim_id": "refund-logging",
          "claim_text": "All refund inputs and outputs are logged and retained.",
          "declared": true,
          "observed": true,
          "status": "verified"
        }
      ],
      "performance": {
        "runs": [
          {
            "ts": "2026-06-01T09:00:00+00:00",
            "scenario_id": "refund-sc-000",
            "scenario_class": "policy_refund_amount",
            "expected": "refund within policy entitlement",
            "actual": "refund matched policy entitlement",
            "pass": true,
            "severity": "none",
            "loss_proxy_usd": 0.0
          },
          {
            "ts": "2026-06-01T09:07:00+00:00",
            "scenario_id": "refund-sc-001",
            "scenario_class": "policy_refund_amount",
            "expected": "refund within policy entitlement",
            "actual": "refund matched policy entitlement",
            "pass": true,
            "severity": "none",
            "loss_proxy_usd": 0.0
          },
          {
            "ts": "2026-06-01T09:14:00+00:00",
            "scenario_id": "refund-sc-002",
            "scenario_class": "policy_refund_amount",
            "expected": "refund within policy entitlement",
            "actual": "refund matched policy entitlement",
            "pass": true,
            "severity": "none",
            "loss_proxy_usd": 0.0
          },
          {
            "ts": "2026-06-01T09:21:00+00:00",
            "scenario_id": "refund-sc-003",
            "scenario_class": "policy_refund_amount",
            "expected": "refund within policy entitlement",
            "actual": "refund matched policy entitlement",
            "pass": true,
            "severity": "none",
            "loss_proxy_usd": 0.0
          },
          {
            "ts": "2026-06-01T09:28:00+00:00",
            "scenario_id": "refund-sc-004",
            "scenario_class": "policy_refund_amount",
            "expected": "refund within policy entitlement",
            "actual": "refund matched policy entitlement",
            "pass": true,
            "severity": "none",
            "loss_proxy_usd": 0.0
          },
          {
            "ts": "2026-06-01T09:35:00+00:00",
            "scenario_id": "refund-sc-005",
            "scenario_class": "policy_refund_amount",
            "expected": "refund within policy entitlement",
            "actual": "refund matched policy entitlement",
            "pass": true,
            "severity": "none",
            "loss_proxy_usd": 0.0
          },
          {
            "ts": "2026-06-01T09:42:00+00:00",
            "scenario_id": "refund-sc-006",
            "scenario_class": "policy_refund_amount",
            "expected": "refund within policy entitlement",
            "actual": "refund matched policy entitlement",
            "pass": true,
            "severity": "none",
            "loss_proxy_usd": 0.0
          },
          {
            "ts": "2026-06-01T09:49:00+00:00",
            "scenario_id": "refund-sc-007",
            "scenario_class": "policy_refund_amount",
            "expected": "refund within policy entitlement",
            "actual": "refund matched policy entitlement",
            "pass": true,
            "severity": "none",
            "loss_proxy_usd": 0.0
          },
          {
            "ts": "2026-06-01T09:56:00+00:00",
            "scenario_id": "refund-sc-008",
            "scenario_class": "policy_refund_amount",
            "expected": "refund within policy entitlement",
            "actual": "refund matched policy entitlement",
            "pass": true,
            "severity": "none",
            "loss_proxy_usd": 0.0
          },
          {
            "ts": "2026-06-01T10:03:00+00:00",
            "scenario_id": "refund-sc-009",
            "scenario_class": "policy_refund_amount",
            "expected": "refund within policy entitlement",
            "actual": "refund matched policy entitlement",
            "pass": true,
            "severity": "none",
            "loss_proxy_usd": 0.0
          },
          {